"","sciname","StockDefs","TempMin","TempMax","SpecCode"
"391","Salvelinus malma","<i>Salvelinus malma miyabei</i>:  Asia:  central Hokkaido, Japan.  A hybrid specimen with the introduced masu salmon <i>Onchorhynchus masou masou</i> was collected in the inlet stream, Yamada Creek, of the Lake; mtDNA suggests that the mating occurred between a femalel Miyabe charr and a male masu salmon; hybridization may cause deleterious effects on Miyabe charr (Ref. 56618).",NA,NA,2691
"392","Lutjanus purpureus","Western Atlantic:  throughout most of the Caribbean Sea from Cuba southward to northeastern Brazil.  Frequently confused with <i>Lutjanus campechanus</i>.  Also referred to as <i>Lutjanus aya</i> by past authors, but Rivas (Ref. 6409) proved that <i>Bodianus aya</i> Bloch, 1790 is not a lutjanid, but probably a sciaenid.",NA,NA,171
"393","Triportheus angulatus","South America:  Amazon River basin.",22,29.7999992370605,12976
"394","Atherina boyeri","Eastern Atlantic:  Portugal and Spain to Nouadhibou in Mauritania and Madeira, and throughout the Mediterranean and Black Sea.  Isolated populations on coasts of England and the Netherlands (Ref. 5980).  Previously, two subspecies were recognized in Russian waters:  <i>Atherina boyeri pontica</i> (Eichwald, 1838) from the Black Sea and the Sea of Azov and <i>Atherina boyeri caspia</i> (Eichwald, 1838) from the Caspian Sea (Ref. 26334).",NA,NA,1696
"395","Boops boops","Eastern Atlantic:  Norway to Angola, including the Canary Islands, Cape Verde, and the Sao Tome-Principe Islands.  Common from Bay of Biscay to Gibraltar (Ref. 4781).  Also found in the Mediterranean and the Black Sea.",NA,NA,203
"396","Spicara smaris","Eastern Atlantic:  entire Mediterranean, the Black Sea, southern Sea of Azov, and Atlantic coasts from Portugal to Morocco, including the Canary Islands and Madeira (Ref. 7349).",NA,NA,1766
"397","Macrognathus aculeatus","Asia:  Thailand, Malay Peninsula, Borneo and Indonesia.  Reported from Bangladesh (Ref. 1479) and Nepal (Ref. 9496); India (Ref. 43634); Viet Nam (Ref. 89724).",23,28,5152
"398","Esomus danricus","Asia:  Pakistan, India, Nepal, Bangladesh (Ref. 41236), Afghanistan (Ref. 41034), Sri Lanka (Ref. 6028)  and Myanmar (Ref. 43640).",22,NA,5150
"399","Corica soborna","Asia:  Indonesia, Brunei, Malaysia and India.  Occurrence in the Bangpakong River in Thailand (Ref. 1632), Mekong (Ref. 12975) and Bangladesh (Ref. 1479) need confirmation.",NA,NA,1566
"400","Amblypharyngodon mola","Asia:  Pakistan, India, Bangladesh and Myanmar (Ref. 4832).  Reported from Afghanistan (Ref. 39701).",NA,NA,24301
"401","Puntius sophore","Asia:  Pakistan, India, Nepal, Bangladesh, Myanmar and Yunnan, China (Ref. 4832), Bhutan (Ref. 40882) and Afghanistan (Ref. 41034)",22,NA,10137
"402","Channa punctata","Asia:  Afghanistan, Pakistan, India, Sri Lanka, Nepal, Bangladesh, Myanmar and Yunnan in China.",22,28,5147
"403","Cirrhinus cirrhosus","Asia:  native to large rivers in the Indian subcontinent (Ref. 12693).  Has been so widely transported in connection to aquaculture that its natural distribution can no longer be determined (Ref. 33488).",NA,NA,4494
"404","Hypophthalmichthys molitrix","Asia:  Native to most major Pacific dainages of East Asia from Amur to Xi Jiang, China (Ref. 59043).  China and Eastern Siberia.  Introduced around the world for aquaculture and control of algal blooms.  Several countries report adverse ecological impact after introduction (Ref. 1739).  Often confused with <i>Hypophthalmichthys nobilis</i> (Ref. 59043).",6,28,274
"405","Rasbora tawarensis","Asia:  Endemic to Lake Tawar, Aceh, Sumatra. Also Ref. 93674.",NA,NA,22639
"406","Channa micropeltes","Asia:  Mekong and Chao Phraya basins; the Malay Peninsula, and the islands of Sumatra and Borneo.  Material from India usually referred to as this species actually represents a distinct species.",25,28,344
"407","Micropogonias furnieri","Western Atlantic:  Greater Antilles and from Costa Rica to Argentina (Ref. 9626).  Also reported in Nicaragua (Ref. 13613).",NA,NA,7620
"408","Salvelinus alpinus alpinus","Europe:  northern Atlantic southward to southern Norway, also Iceland and southern Greenland.  Isolated populations in Northern UK, Scandinavia, Finland and the Alps.  North America:  Landlocked populations in Quebec, Canada and in Maine and New Hampshire in USA (Ref. 7251).",4,16,247
"409","Boreogadus saida","Circumpolar in the Arctic.  North Atlantic:  White Sea, Iceland, and southern Greenland into the Miramichi River, New Brunswick in Canada.  North Pacific:  Bering Sea to Cape Olyutorski, the Pribilof Islands, and Bristol Bay.",-2,8,319
"410","Thymallus arcticus","North America:  widespread in Arctic drainages from Hudson Bay, Canada to Alaska and in Arctic and Pacific drainages to central Alberta and British Columbia in Canada; upper Missouri River drainage in Montana, USA.  Formerly in Great Lakes basin in Michigan, USA (Ref. 5723).  Arctic Ocean basin in Siberia from Ob to Yenisei drainages and in Europe in some tributaries of Pechora (Usa, Kosyu, Kozhim), Korotaikha and Kara (Ref. 59043).",NA,NA,2693
